{
  "$schema": "../../schemas/param-tune-manifest.schema.json",
  "screenId": "LobbyMain",
  "sourceFamilyMap": "LobbyMain",
  "generatedAt": "2026-04-11T12:33:00.000Z",
  "taskCount": 0,
  "tasks": [],
  "warnings": [
    "runtime spacing and text density for morning report strip should be checked after first capture"
  ]
}